monitoring.cloudwatch.sla_dashboard,Monitoring,amatra-isb-sla-prod,amatra-isb-sla-dev,amatra-isb-sla-prod,CloudWatch dashboard name for monthly availability percentage and job completion rate vs SLA targets,Yes,String,Non-empty string max 255 chars,Public,Operations,aws.region,Tracks 99.9% availability and ≤60 min job completion SLA; reviewed by VP Engineering weekly,2026-07-01
monitoring.cloudwatch.quality_dashboard,Monitoring,amatra-isb-quality-prod,amatra-isb-quality-dev,amatra-isb-quality-prod,CloudWatch dashboard name for QA first-pass acceptance rate and Bedrock token consumption,Yes,String,Non-empty string max 255 chars,Public,Operations,aws.region,Tracks ≥90% QA first-pass target and monthly token budget; token P3 alarm fires at 80% consumed,2026-07-01
monitoring.cloudwatch.log_retention_days,Monitoring,90,30,90,Retention period in days for all Lambda function CloudWatch Log Groups,Yes,Integer,1-3653,Public,Operations,,90 days balances cost and investigation window; structured JSON format enables Log Insights queries,2026-07-01
monitoring.sns.alerts_topic_arn,Monitoring,[sns-alerts-topic-arn],[sns-alerts-topic-arn],[sns-alerts-topic-arn],SNS topic ARN for operational alerts routing to PagerDuty (P1) and Slack (P2),Yes,String,Valid SNS ARN,Confidential,Operations,aws.region,All CloudWatch alarms route to this topic; subscriptions: PagerDuty P1 / Slack #amatra-isb-ops P2,2026-07-01
monitoring.alarm.job_failure_rate_threshold_pct,Monitoring,5,10,5,Async job failure rate percentage threshold that triggers a P1 PagerDuty alert,Yes,Integer,1-100,Public,Operations,monitoring.sns.alerts_topic_arn,Evaluated over 5-minute window on Step Functions execution failure rate metric,2026-07-01
monitoring.alarm.api_5xx_threshold_pct,Monitoring,1,5,1,API Gateway 5xx error rate percentage threshold that triggers a P2 Slack alert,Yes,Integer,1-100,Public,Operations,monitoring.sns.alerts_topic_arn,Evaluated over 15-minute window; VP Engineering notified via Slack #amatra-isb-ops,2026-07-01
monitoring.alarm.bedrock_budget_warning_pct,Monitoring,80,80,80,Bedrock monthly token consumption percentage threshold that triggers a P3 email alert,Yes,Integer,50-100,Public,Operations,monitoring.sns.alerts_topic_arn,Email sent to Head of Solutions; triggers Haiku substitution review per detailed design cost model,2026-07-01
monitoring.alarm.dlq_depth_threshold,Monitoring,1,1,1,SQS DLQ message count threshold that triggers a P1 alert,Yes,Integer,1-1000,Public,Operations,"monitoring.sns.alerts_topic_arn,integration.sqs.dlq_name",Any DLQ message is P1; evaluated immediately; VP Engineering investigates failed job,2026-07-01
monitoring.alarm.cognito_auth_failure_pct,Monitoring,10,20,10,Cognito authentication failure rate percentage threshold triggering a P2 alert and GuardDuty review,Yes,Integer,1-100,Public,Operations,"monitoring.sns.alerts_topic_arn,security.guardduty_enabled",Credential-stuffing detection; automated Lambda remediation suspends Cognito user if GuardDuty confirms,2026-07-01
monitoring.synthetics.health_check_interval_seconds,Monitoring,60,300,60,CloudWatch Synthetics canary polling interval in seconds for GET /api/v1/health availability measurement,Yes,Integer,60-3600,Public,Operations,integration.api_gateway.rest_api_id,Primary SLA measurement signal for 99.9% monthly availability target; runs from us-west-2,2026-07-01
operations.usage_limit.per_user_monthly_default,Operations,10,5,10,Default monthly generation count limit per Amatra internal user,Yes,Integer,1-1000,Public,Operations,database.usage_tracking_table,Enforced by pre-authorisation Lambda before each job submission; AmAdmin can override per user,2026-07-01
operations.usage_limit.global_monthly_default,Operations,240,50,240,Default monthly global generation count limit across all users,Yes,Integer,1-10000,Public,Operations,database.usage_tracking_table,240 = 24 engagements/quarter × 10 artifact types; AmAdmin can override; aligned to SOW scope,2026-07-01
operations.backup.cognito_export_schedule,Operations,cron(0 2 * * ? *),cron(0 2 * * ? *),cron(0 2 * * ? *),CloudWatch Events cron expression for nightly Cognito user pool export to S3,Yes,String,Valid CloudWatch Events cron expression,Public,Operations,"storage.s3.artifacts_bucket_name,security.cognito.user_pool_id",Nightly at 02:00 UTC; export encrypted with amatra-s3-artifacts-cmk; ~120 users; RTO ≤30 min restore,2026-07-01
operations.backup.dynamodb_pitr_window_days,Operations,35,7,35,DynamoDB PITR continuous backup window in days,Yes,Integer,1-35,Public,Operations,database.pitr_enabled,AWS maximum is 35 days; supports RPO ≤15 min target; restore tested at each phase go-live gate,2026-07-01
operations.cicd.github_repo,Operations,amatra/amatra-isb,amatra/amatra-isb,amatra/amatra-isb,GitHub repository containing all Lambda source code and CloudFormation/SAM templates,Yes,String,"Valid GitHub org/repo format",Confidential,Cloud CoE,,GitOps model; all infra changes via pull request; no direct console changes to Production,2026-07-01
operations.cicd.production_approval_required,Operations,true,false,true,Require manual GitHub Actions approval gate before deploying to Production environment,Yes,Boolean,true|false,Public,Cloud CoE,operations.cicd.github_repo,Approval action logged to CloudTrail; VP Engineering is designated approver for production deploys,2026-07-01
operations.cicd.lambda_alias_prod,Operations,$PROD,$DEV,$PROD,Lambda function alias name used for production traffic routing in blue-green deployments,Yes,String,Non-empty string max 128 chars,Public,Cloud CoE,compute.lambda.runtime,Blue-green promotion; rollback = revert alias to prior version; target ≤30 min rollback time,2026-07-01
operations.rollback.trigger_job_failure_pct,Operations,20,50,20,Async job failure rate percentage within 4 hours of cutover that triggers automatic rollback,Yes,Integer,1-100,Public,Operations,monitoring.alarm.job_failure_rate_threshold_pct,One of 4 rollback triggers per SOW cutover plan; decision authority: vendor PM + VP Engineering,2026-07-01
operations.rollback.trigger_5xx_pct,Operations,5,10,5,API Gateway 5xx error rate percentage within 4 hours of cutover that triggers rollback,Yes,Integer,1-100,Public,Operations,monitoring.alarm.api_5xx_threshold_pct,Rollback target ≤30 min; Lambda alias revert via single GitHub Actions workflow step,2026-07-01
operations.qa.first_pass_target_pct,Operations,90,80,90,Target QA first-pass acceptance rate percentage for generated artifacts,Yes,Integer,1-100,Public,Operations,application.artifact_types,Phase 2 QA validation layer automates scoring; artifacts below threshold flagged for human review,2026-07-01
operations.hypercare.phase1_duration_weeks,Operations,8,0,8,Duration in weeks of Phase 1 hypercare support period post-MVP go-live (target: 30 Sep 2026),Yes,Integer,1-52,Public,Operations,,Business hours 09:00–18:00 CT Mon–Fri; P1 ≤2 h response; P2 next business day; Slack channel,2026-07-01
operations.hypercare.phase2_duration_weeks,Operations,4,0,4,Duration in weeks of Phase 2 hypercare support period post-Phase 2 go-live (target: 15 Dec 2026),Yes,Integer,1-52,Public,Operations,,Business hours 09:00–18:00 CT Mon–Fri; P1 ≤2 h response; P2 next business day; Slack channel,2026-07-01
