storage.log_archive.bucket_name,Storage,[bucket-name],[bucket-name],[bucket-name],S3 bucket name in Log Archive account for centralised CloudTrail and Config log storage,Yes,String,Globally unique bucket name; lowercase alphanumeric hyphens,Confidential,Operations,aws.account_id.log_archive,Object Lock (Compliance mode) must be enabled at bucket creation; cannot be disabled post-creation,2025-06-01
storage.log_archive.object_lock_mode,Storage,COMPLIANCE,COMPLIANCE,COMPLIANCE,S3 Object Lock mode enforcing WORM retention on log archive bucket,Yes,String,COMPLIANCE|GOVERNANCE,Confidential,Security Team,storage.log_archive.bucket_name,COMPLIANCE mode prevents deletion by any identity including root; required for ISO 27001 evidence immutability,2025-06-01
storage.log_archive.crr_destination_bucket,Storage,[bucket-name],[bucket-name],[bucket-name],S3 bucket name in ap-southeast-4 as the cross-region replication destination for log archive data,Yes,String,Globally unique bucket name; lowercase alphanumeric hyphens,Confidential,Operations,storage.log_archive.bucket_name,Sub-minute CRR lag ensures RPO < 1 hour; destination bucket in DR region ap-southeast-4,2025-06-01
storage.log_archive.cloudtrail_log_volume_gb_monthly,Storage,200,50,200,Expected monthly CloudTrail log volume in GB used for S3 capacity planning,Yes,Integer,1-10000,Public,Operations,storage.log_archive.bucket_name,SOW scope: 50–200 GB/month medium tier; S3 Standard used (Intelligent-Tiering incompatible with Object Lock),2025-06-01
storage.terraform_state.bucket_name,Storage,[bucket-name],[bucket-name],[bucket-name],S3 bucket name in Management account for Terraform state files across all workspaces,Yes,String,Globally unique bucket name; lowercase alphanumeric hyphens,Confidential,Cloud CoE,aws.account_id.management,Versioning enabled; access restricted to AFT pipeline IAM role only; backed up daily by AWS Backup,2025-06-01
storage.terraform_state.versioning_enabled,Storage,true,true,true,Enable S3 versioning on Terraform state bucket to support state file rollback,Yes,Boolean,true|false,Public,Cloud CoE,storage.terraform_state.bucket_name,Required for Terraform state rollback capability; previous state versions retained per backup policy,2025-06-01
compute.lambda.siem_forward.memory_mb,Compute,1024,1024,1024,Memory allocation in MB for the SIEM forwarding Lambda function,Yes,Integer,128-10240,Public,Cloud CoE,integration.siem.api_endpoint,1024 MB provides sufficient headroom for JSON transformation; adjust based on Phase 3 X-Ray profiling,2025-06-01
compute.lambda.siem_forward.timeout_seconds,Compute,30,30,30,Timeout in seconds for the SIEM forwarding Lambda function,Yes,Integer,1-900,Public,Cloud CoE,integration.siem.delivery_sla_minutes,30-second timeout well within 5-minute SIEM delivery SLA; Lambda DLQ handles retries on timeout,2025-06-01
compute.lambda.siem_forward.reserved_concurrency,Compute,10,10,10,Reserved concurrency for SIEM forwarding Lambda to prevent throttling on peak finding volumes,Yes,Integer,1-1000,Public,Cloud CoE,monitoring.securityhub.finding_volume_monthly,Sized for ~1000 findings/month per SOW scope; increase if finding volume exceeds this estimate,2025-06-01
compute.lambda.itsm_integration.memory_mb,Compute,512,512,512,Memory allocation in MB for the ITSM change-approval integration Lambda function,Yes,Integer,128-10240,Public,Cloud CoE,integration.itsm.api_endpoint,512 MB sufficient for JSON payload processing and OAuth token management,2025-06-01
compute.lambda.itsm_integration.reserved_concurrency,Compute,5,5,5,Reserved concurrency for ITSM integration Lambda to prevent API rate limit exhaustion,Yes,Integer,1-1000,Public,Cloud CoE,integration.itsm.api_endpoint,5 concurrent executions sufficient for expected account vending request rate; aligns with AFT max concurrent,2025-06-01
compute.lambda.config_remediation.memory_mb,Compute,512,512,512,Memory allocation in MB for the Config auto-remediation Lambda function,Yes,Integer,128-10240,Public,Security Team,monitoring.config.rule_count,Auto-remediation scoped to governance resources only via IAM role; not executed against workload resources,2025-06-01
compute.lambda.config_remediation.max_concurrency,Compute,20,20,20,Maximum concurrency for Config auto-remediation Lambda to control remediation blast radius,Yes,Integer,1-1000,Public,Security Team,compute.lambda.config_remediation.memory_mb,Capped at 20 to avoid simultaneous remediation of too many resources; P2 alert if threshold approached,2025-06-01
compute.lambda.aft_pipeline.memory_mb,Compute,3008,3008,3008,Memory allocation in MB for AFT account vending Lambda functions,Yes,Integer,128-10240,Public,Cloud CoE,aft.pipeline.itsm_approval_required,3008 MB (max for 6 vCPU Lambda) used for AFT account provisioning functions; reduces cold start latency,2025-06-01
operations.backup.plan_name,Operations,cntso-platform-backup-prod,cntso-platform-backup-nonprod,cntso-platform-backup-dr,AWS Backup plan name covering DynamoDB and S3 configuration buckets,Yes,String,Non-empty string matching naming convention,Public,Operations,aws.account_id.management,Daily backups with 30-day retention per SOW operational design; replicated to ap-southeast-4,2025-06-01
operations.backup.retention_days,Operations,30,7,30,Backup retention period in days for AWS Backup daily plan,Yes,Integer,7-365,Public,Operations,operations.backup.plan_name,SOW: 30-day retention for platform state protection; 7-day retention in nonprod for cost saving,2025-06-01
operations.backup.dr_replication_enabled,Operations,true,false,true,Enable AWS Backup cross-region replication to ap-southeast-4 DR region,Yes,Boolean,true|false,Public,Operations,operations.backup.plan_name,Replication to DR region ensures backup availability during ap-southeast-2 regional failure,2025-06-01
operations.dr.rto_hours,Operations,4,4,4,Recovery Time Objective in hours for governance platform DR failover,Yes,Integer,1-24,Public,Operations,networking.transit_gateway.dr_id,SOW hard requirement: RTO < 4 hours; validated via Phase 3 DR failover drill; result in evidence package,2025-06-01
operations.dr.rpo_hours,Operations,1,1,1,Recovery Point Objective in hours for governance platform DR failover,Yes,Integer,1-24,Public,Operations,storage.log_archive.crr_destination_bucket,SOW hard requirement: RPO < 1 hour; met by S3 CRR sub-minute lag; validated in Phase 3,2025-06-01
operations.dr.failover_activation_criteria_minutes,Operations,30,30,30,Minutes of governance evidence collection failure before DR activation is triggered,Yes,Integer,15-120,Public,Operations,operations.dr.rto_hours,DR activated if compliance evidence collection is disrupted for > 30 minutes per detailed design,2025-06-01
operations.patch.baseline_schedule,Operations,monthly,monthly,monthly,Patch Manager patching baseline schedule frequency for any platform instances,Yes,String,"daily|weekly|monthly",Public,Operations,aws.account_id.management,No direct SSH/RDP; all patching via SSM Patch Manager and Session Manager per no-console-access mandate,2025-06-01
operations.compliance.evidence_package_schedule,Operations,Phase3,Phase3,Phase3,Phase deliverable in which the ISO 27001 compliance evidence package is compiled and delivered,Yes,String,"Phase1|Phase2|Phase3",Public,Security Team,monitoring.config.rule_count,SOW: evidence package delivered by end of Phase 3 (Week 15) for CISO review before April 2026 deadline,2025-06-01
operations.platform_availability_target,Operations,99.9,99.9,99.9,Platform availability target percentage for governance services per SOW SLA,Yes,Float,0-100,Public,Operations,monitoring.cloudwatch.alert_sns_topic_arn,SOW commitment: 99.9% availability for platform services; measured via CloudWatch uptime monitoring,2025-06-01
operations.change_freeze.pre_review_days,Operations,14,14,14,Number of days before Q2 2026 regulatory review during which a change freeze is enforced,Yes,Integer,7-30,Public,Security Team,integration.itsm.change_freeze_scp_condition,SOW: 14-day change freeze before regulatory review; SCP denies AFT execution without ITSM approval during freeze,2025-06-01
operations.hypercare.duration_weeks,Operations,8,8,8,Duration of post-go-live hypercare support period in weeks,Yes,Integer,4-52,Public,Cloud CoE,,SOW commitment: 8-week hypercare covering April 2026 regulatory review window,2025-06-01
operations.hypercare.p1_response_hours,Operations,2,2,2,Maximum response time in hours for P1 (platform outage or compliance-blocking) issues during hypercare,Yes,Integer,1-24,Public,Cloud CoE,operations.hypercare.duration_weeks,SOW SLA: 2-hour P1 response during hypercare; P2 is next business day; business hours AEST coverage,2025-06-01
